{
  "record_type": "tbc243_world_map_zone_transform_catalog",
  "schema_version": "1.0",
  "target_profile": "tbc_243_lab",
  "client_build": "2.4.3.8606",
  "asset_name": "WorldMapArea.dbc",
  "asset_sha256": "918BF402A83BAA78B0D35F0978BC760683291EE8CF48D7CE8C90E3814AA1BC7B",
  "record_fingerprint_sha256": "82CB76957FC8BB0A6DB94AC1F179BE5EA3B96033AEA02ED3B597D030D9A66215",
  "coordinate_space": "wow_world_map_2d",
  "provenance_origin": "client_asset_calibration",
  "source_reference": "data/runtime/navigation-f3b/client-world-map-area-audit-20260831.json",
  "retrieved_at": "2026-08-31T00:00:00Z",
  "zones": [
    {
      "map_id": 0,
      "area_id": 0,
      "internal_name": "Azeroth",
      "bounds": [
        18171.970703125,
        -22569.2109375,
        11176.34375,
        -15973.34375
      ]
    },
    {
      "map_id": 0,
      "area_id": 1,
      "internal_name": "DunMorogh",
      "bounds": [
        1802.083251953125,
        -3122.91650390625,
        -3877.083251953125,
        -7160.41650390625
      ]
    },
    {
      "map_id": 0,
      "area_id": 3,
      "internal_name": "Badlands",
      "bounds": [
        -2079.16650390625,
        -4566.66650390625,
        -5889.5830078125,
        -7547.91650390625
      ]
    },
    {
      "map_id": 0,
      "area_id": 4,
      "internal_name": "BlastedLands",
      "bounds": [
        -1241.6666259765625,
        -4591.66650390625,
        -10566.666015625,
        -12800.0
      ]
    },
    {
      "map_id": 0,
      "area_id": 8,
      "internal_name": "SwampOfSorrows",
      "bounds": [
        -2222.91650390625,
        -4516.66650390625,
        -9620.8330078125,
        -11150.0
      ]
    },
    {
      "map_id": 0,
      "area_id": 10,
      "internal_name": "Duskwood",
      "bounds": [
        833.3333129882812,
        -1866.6666259765625,
        -9716.666015625,
        -11516.666015625
      ]
    },
    {
      "map_id": 0,
      "area_id": 11,
      "internal_name": "Wetlands",
      "bounds": [
        -389.58331298828125,
        -4525.0,
        -2147.91650390625,
        -4904.16650390625
      ]
    },
    {
      "map_id": 0,
      "area_id": 12,
      "internal_name": "Elwynn",
      "bounds": [
        1535.4166259765625,
        -1935.4166259765625,
        -7939.5830078125,
        -10254.166015625
      ]
    },
    {
      "map_id": 0,
      "area_id": 28,
      "internal_name": "WesternPlaguelands",
      "bounds": [
        416.6666564941406,
        -3883.333251953125,
        3366.66650390625,
        499.9999694824219
      ]
    },
    {
      "map_id": 0,
      "area_id": 33,
      "internal_name": "Stranglethorn",
      "bounds": [
        2220.833251953125,
        -4160.41650390625,
        -11168.75,
        -15422.916015625
      ]
    },
    {
      "map_id": 0,
      "area_id": 36,
      "internal_name": "Alterac",
      "bounds": [
        783.3333129882812,
        -2016.6666259765625,
        1500.0,
        -366.6666564941406
      ]
    },
    {
      "map_id": 0,
      "area_id": 38,
      "internal_name": "LochModan",
      "bounds": [
        -1993.7498779296875,
        -4752.0830078125,
        -4487.5,
        -6327.0830078125
      ]
    },
    {
      "map_id": 0,
      "area_id": 40,
      "internal_name": "Westfall",
      "bounds": [
        3016.66650390625,
        -483.33331298828125,
        -9400.0,
        -11733.3330078125
      ]
    },
    {
      "map_id": 0,
      "area_id": 41,
      "internal_name": "DeadwindPass",
      "bounds": [
        -833.3333129882812,
        -3333.333251953125,
        -9866.666015625,
        -11533.3330078125
      ]
    },
    {
      "map_id": 0,
      "area_id": 44,
      "internal_name": "Redridge",
      "bounds": [
        -1570.833251953125,
        -3741.66650390625,
        -8575.0,
        -10022.916015625
      ]
    },
    {
      "map_id": 0,
      "area_id": 45,
      "internal_name": "Arathi",
      "bounds": [
        -866.6666259765625,
        -4466.66650390625,
        -133.3333282470703,
        -2533.333251953125
      ]
    },
    {
      "map_id": 0,
      "area_id": 46,
      "internal_name": "BurningSteppes",
      "bounds": [
        -266.6666564941406,
        -3195.833251953125,
        -7031.24951171875,
        -8983.3330078125
      ]
    },
    {
      "map_id": 0,
      "area_id": 47,
      "internal_name": "Hinterlands",
      "bounds": [
        -1575.0,
        -5425.0,
        1466.6666259765625,
        -1100.0
      ]
    },
    {
      "map_id": 0,
      "area_id": 51,
      "internal_name": "SearingGorge",
      "bounds": [
        -322.9166564941406,
        -2554.16650390625,
        -6100.0,
        -7587.49951171875
      ]
    },
    {
      "map_id": 0,
      "area_id": 85,
      "internal_name": "Tirisfal",
      "bounds": [
        3033.333251953125,
        -1485.4166259765625,
        3837.499755859375,
        824.9999389648438
      ]
    },
    {
      "map_id": 0,
      "area_id": 130,
      "internal_name": "Silverpine",
      "bounds": [
        3449.999755859375,
        -750.0,
        1666.6666259765625,
        -1133.333251953125
      ]
    },
    {
      "map_id": 0,
      "area_id": 139,
      "internal_name": "EasternPlaguelands",
      "bounds": [
        -2185.41650390625,
        -6056.25,
        3799.999755859375,
        1218.75
      ]
    },
    {
      "map_id": 0,
      "area_id": 267,
      "internal_name": "Hilsbrad",
      "bounds": [
        1066.6666259765625,
        -2133.333251953125,
        400.0,
        -1733.333251953125
      ]
    },
    {
      "map_id": 0,
      "area_id": 1497,
      "internal_name": "Undercity",
      "bounds": [
        873.192626953125,
        -86.18240356445312,
        1877.9453125,
        1237.8411865234375
      ]
    },
    {
      "map_id": 0,
      "area_id": 1519,
      "internal_name": "Stormwind",
      "bounds": [
        1380.971435546875,
        36.70063018798828,
        -8278.8505859375,
        -9175.205078125
      ]
    },
    {
      "map_id": 0,
      "area_id": 1537,
      "internal_name": "Ironforge",
      "bounds": [
        -713.5913696289062,
        -1504.2164306640625,
        -4569.2412109375,
        -5096.845703125
      ]
    },
    {
      "map_id": 1,
      "area_id": 0,
      "internal_name": "Kalimdor",
      "bounds": [
        17066.599609375,
        -19733.2109375,
        12799.900390625,
        -11733.2998046875
      ]
    },
    {
      "map_id": 1,
      "area_id": 14,
      "internal_name": "Durotar",
      "bounds": [
        -1962.4998779296875,
        -7249.99951171875,
        1808.333251953125,
        -1716.6666259765625
      ]
    },
    {
      "map_id": 1,
      "area_id": 15,
      "internal_name": "Dustwallow",
      "bounds": [
        -974.9999389648438,
        -6225.0,
        -2033.333251953125,
        -5533.3330078125
      ]
    },
    {
      "map_id": 1,
      "area_id": 16,
      "internal_name": "Aszhara",
      "bounds": [
        -3277.083251953125,
        -8347.916015625,
        5341.66650390625,
        1960.4166259765625
      ]
    },
    {
      "map_id": 1,
      "area_id": 17,
      "internal_name": "Barrens",
      "bounds": [
        2622.91650390625,
        -7510.41650390625,
        1612.4998779296875,
        -5143.75
      ]
    },
    {
      "map_id": 1,
      "area_id": 141,
      "internal_name": "Teldrassil",
      "bounds": [
        3814.583251953125,
        -1277.083251953125,
        11831.25,
        8437.5
      ]
    },
    {
      "map_id": 1,
      "area_id": 148,
      "internal_name": "Darkshore",
      "bounds": [
        2941.66650390625,
        -3608.333251953125,
        8333.3330078125,
        3966.66650390625
      ]
    },
    {
      "map_id": 1,
      "area_id": 215,
      "internal_name": "Mulgore",
      "bounds": [
        2047.9166259765625,
        -3089.583251953125,
        -272.9166564941406,
        -3697.91650390625
      ]
    },
    {
      "map_id": 1,
      "area_id": 331,
      "internal_name": "Ashenvale",
      "bounds": [
        1699.9998779296875,
        -4066.66650390625,
        4672.91650390625,
        829.1666259765625
      ]
    },
    {
      "map_id": 1,
      "area_id": 357,
      "internal_name": "Feralas",
      "bounds": [
        5441.66650390625,
        -1508.333251953125,
        -2366.66650390625,
        -6999.99951171875
      ]
    },
    {
      "map_id": 1,
      "area_id": 361,
      "internal_name": "Felwood",
      "bounds": [
        1641.6666259765625,
        -4108.3330078125,
        7133.3330078125,
        3299.999755859375
      ]
    },
    {
      "map_id": 1,
      "area_id": 400,
      "internal_name": "ThousandNeedles",
      "bounds": [
        -433.33331298828125,
        -4833.3330078125,
        -3966.66650390625,
        -6899.99951171875
      ]
    },
    {
      "map_id": 1,
      "area_id": 405,
      "internal_name": "Desolace",
      "bounds": [
        4233.3330078125,
        -262.5,
        452.08331298828125,
        -2545.833251953125
      ]
    },
    {
      "map_id": 1,
      "area_id": 406,
      "internal_name": "StonetalonMountains",
      "bounds": [
        3245.833251953125,
        -1637.4998779296875,
        2916.66650390625,
        -339.58331298828125
      ]
    },
    {
      "map_id": 1,
      "area_id": 440,
      "internal_name": "Tanaris",
      "bounds": [
        -218.74998474121094,
        -7118.74951171875,
        -5875.0,
        -10475.0
      ]
    },
    {
      "map_id": 1,
      "area_id": 490,
      "internal_name": "UngoroCrater",
      "bounds": [
        533.3333129882812,
        -3166.66650390625,
        -5966.66650390625,
        -8433.3330078125
      ]
    },
    {
      "map_id": 1,
      "area_id": 493,
      "internal_name": "Moonglade",
      "bounds": [
        -1381.25,
        -3689.583251953125,
        8491.666015625,
        6952.0830078125
      ]
    },
    {
      "map_id": 1,